{
  "$ref": "#/definitions/PolicyDecision",
  "definitions": {
    "PolicyDecision": {
      "type": "object",
      "properties": {
        "schema": {
          "type": "string",
          "const": "workforce.policy-decision/v1"
        },
        "decision": {
          "type": "string",
          "enum": [
            "ALLOW",
            "DENY",
            "REQUIRE_APPROVAL"
          ]
        },
        "constraints": {
          "type": "array",
          "items": {
            "type": "object",
            "properties": {
              "key": {
                "type": "string",
                "minLength": 1
              },
              "description": {
                "type": "string",
                "minLength": 1
              },
              "value": {}
            },
            "required": [
              "key",
              "description"
            ],
            "additionalProperties": false
          }
        },
        "obligations": {
          "type": "array",
          "items": {
            "type": "object",
            "properties": {
              "key": {
                "type": "string",
                "minLength": 1
              },
              "description": {
                "type": "string",
                "minLength": 1
              },
              "value": {}
            },
            "required": [
              "key",
              "description"
            ],
            "additionalProperties": false
          }
        },
        "reasons": {
          "type": "array",
          "items": {
            "type": "object",
            "properties": {
              "code": {
                "type": "string",
                "minLength": 1
              },
              "message": {
                "type": "string",
                "minLength": 1
              }
            },
            "required": [
              "code",
              "message"
            ],
            "additionalProperties": false
          }
        },
        "policyVersion": {
          "type": "string",
          "minLength": 1
        },
        "policyDigest": {
          "type": "string",
          "pattern": "^sha256:[0-9a-f]{64}$"
        },
        "cerbosCallId": {
          "type": "string",
          "minLength": 1
        },
        "decidedAt": {
          "type": "string",
          "pattern": "^\\d{4}-\\d{2}-\\d{2}T\\d{2}:\\d{2}:\\d{2}(\\.\\d{1,9})?(Z|[+-]\\d{2}:\\d{2})$"
        }
      },
      "required": [
        "schema",
        "decision",
        "constraints",
        "obligations",
        "reasons",
        "policyVersion",
        "policyDigest",
        "cerbosCallId",
        "decidedAt"
      ],
      "additionalProperties": false
    }
  },
  "$schema": "http://json-schema.org/draft-07/schema#"
}
